{
  "name": "product-marketing",
  "version": "1.0.0",
  "description": "Comprehensive skills for product marketers — Pragmatic Framework go-to-market execution (positioning, launch, content, channels, sales tools, measurement) combined with Seven Powers competitive strategy (moats, counter-positioning, network effects, process power, branding).",
  "author": "agent-resource-catalog contributors",
  "category": "role",
  "tags": ["product-marketing", "pragmatic-framework", "seven-powers", "positioning", "launch", "go-to-market", "competitive-strategy"],
  "plugin_format_version": "1"
}
